easy use,"Easy, friendly, helpful, useful, versatile, intuitive, robust, Interface, functionality, learning, service, feature, tool, software, user"
complex survey,"Best, complex, easy, complicated, robust, simple, Tool, package, Monkey, system, software, option, platform, survey"
customer service,"Responsive, good, great, slow, outstanding, helpful, excellent, Service, support, customer, product, tool, survey, quality, platform, interface, software"
tech support,"Awesome, good, great, excellent, helpful, fantastic, Tech, customer, phone, feature, quality, service, team, staff, support"
great tool,"Easy, best, robust, good, flexible, awesome, great, excellent, powerful, useful, complete, Survey, tool, feature, customer, service, reporting, support, interface"
great product,"Good, great, excellent, awesome, simple, robust, easy, Service, support, quality, survey, customer, product"
nice feature,"Cool, powerful, rich, nice, advanced, excellent, Product, set, software, survey, interface, feature"
intuitive software,"Intuitive, easy, great, friendly, flexible, excellent, Survey, feature, user, customer, service, support, software"
question design,"Complex, great, simple, formatted, good, customizable, Variety, type, design, survey, building, question"
best platform,"Excellent, good, friendly, intuitive, great, easy, best, Service, support, user, survey, software, platform"
customer service,"customer, service, customer, service, customer, support, response, time, call, phone, service, people, support, team, knowledge, help, tech, support, friendly, great, superlative, available, prompt, superb, knowledgeable, rude, unprofessional, excellent"
ease of use,"ease, of, use, accessibility, interface, quirks, user, friendly, one, stop, ease, easy, accessible, simple, complicated, intuitive, difficult, quick, usability"
survey creation,"survey, creation, questions, flexibility, variety, dialogue, customization, survey, range, sophisticated, complex, flexible, comprehensive, rich, wide, customizable"
cost,"cost, price, billing, cost, expense, bill, payment, fee, per, year, expensive, affordable, unaffordable, pricey, cheap"
general capabilities,"general, capabilities, features, capabilities, expanding, software, revolutionize, product, quality, performance, experience, flaws, versatility, robust, capable, advanced, innovative, functional, versatile"
problems and bugs,"problems, and, bugs, issues, problems, bugs, stability, reliability, availability, website, site, buggy, stable, reliable, available, slow, sluggish"
reporting services,"reporting, services, reporting, dashboards, reports, aggregate, responses, excel, exports, terrible, limited, good, bad"
support materials,"support, materials, training, videos, materials, support, materials, tutorials, on, boarding, useful, helpful, unhelpful"
look and feel,"look, and, feel, look, feel, interface, layout, appearance, ux, nice, good, clean"
distribution,"Distribution, distribution, panels, distribute, quick, easy"
affordable cost,"Affordable, cost, pricing, educational, pricing, student, accounts, cost, cheap, inexpensive, affordable, cost, effective, reasonable, high, pricey"
easy to use,"Easy, to, Use, tool, training, navigate, easy, convenient, user, friendly, intuitive, easy, to, use, ease, of, use, usability, friendliness"
excellent features,"Excellent, Features, features, product, package, feature, set, capabilities, functionality, tool, platform, excellent, advanced, comprehensive, options, customizable, robust, flexible, powerful, versatile"
customer service,"Customer, Service, customer, service, support, answers, help, desk, phone, service, assistance, documentation, tutorials, training, terrific, amazing, top, notch, excellent, engaged, helpful, responsive, friendly"
updates,"Updates, updates, survey, updates, improvements, capabilities, continued, new, improved, expanding, constant"
reporting tools,"Reporting, Tools, reporting, reporting, tools, reporting, tool, reporter, broken, buggy, wait, bad"
problems and challenges,"Problems, Challenges, problems, limitations, annoyances, challenge, issues, delays, drawbacks, frustrating, pain, difficult, time, consuming, tricky, lacking, cumbersome"
response time,"Response, Time, wait, wait, time, time, hours, days, response, customer, support, support, team, tech, support, down, difficult, slow, unimpressed, rude, unprofessional"
display results,"Display, Results, results, display, view, data, responses, quirks, order, focus, effective"
research,"Research, research, market, research, researcher, research, suite, collecting, data, needs, easier, easy, great, good, excellent"
responsive customer service,"customer service, support, service, good, excellent, great, helpful, spotty, responsive, friendly, available, slow"
flexible product,"product, application, software, system, platform, flexible, intuitive, sophisticated, limited"
extensive functionality,"functionality, capability, feature, program, tool, extensive, simple, powerful, fantastic, broken, dynamic"
versatile report,"report, response, survey, nice, robust, versatile, best, ugly, comprehensive"
user friendly interface,"interface, design, layout, user friendly, easy, clean"
substantial issue,"issue, challenge, problem, concern, substantial, slow, usability"
high price,"price, cost, reasonable, high, expensive, affordable, low, prohibitive"
lacking training,"set-up, tutorial, training, lacking, little, effective, bad, easy"
strong quality,"quality, performance, high, strong"
sluggish website,"website, site, sluggish, easy"
qualtrics,"qualtrics, capabilities, reporting, flexible, interface, friendly, product, platform, excellent, user, easy"
surveys,"surveys, flexibility, software, features, tools, panels, options, helpful, service, support, recommend"
intuitive,"intuitive, use, panel, ability, reports, great, data, questions, simple, needs, question"
functionality,"functionality, suite, expensive, etc, complex, cost, professional, system, services, training, available"
responsive,"responsive, always, used"
customer,"customer, tech, recommended, improved, quality, feedback, email, advanced, answers, solution, users"
ease,"ease, issues, seems, provide, program, good, call, using, happy, help, market"
tool,"tool, logic, improve, staff, needed, research, results, online, quite, phone, price"
triggers,"triggers, need, work"
robust,robust
opt outs,"pleased, functional, analytical, opt, folders, detractor, administrator, bugs, capability, incidence, outs, client, requests, efficiency"
smaller businesses,"fabulous, download, reasonable, difficult, smaller, overview, administration, expert, businesses, tickets, products, requirements"
competitive price,"offline, complete, competitive, specific, agent, annual, access, phone, account, ways, market, answer, price, report, guys, experience"
previous weeks,"previous, due, luck, availability, request, company, site, address, management, weeks, addition, everything, things"
small companies,"outstanding, amazing, ed, longer, range, unable, past, poor, small, projects, hear, companies, issue, page, direction"
complete report,"offline, complete, competitive, specific, agent, annual, access, phone, account, ways, market, answer, price, report, guys, experience"
effective solution,"useful, easier, complex, unwilling, overall, simple, multiple, effective, researchers, solution, formats, users, questions, types, respond, lots"
great documentation,"prohibitive, great, documentation, packages, ability, clients, possibilities, salesforce, creators, functions, reports, answers"
much job,"much, look, many, quirks, resources, catch, feel, job, number, business, relationship, someone, type"
robust capabilities,"intuitive, responsive, robust, unprofessional, qualtrics, surveys, functionality, usability, versatility, customer, ease, customization, tool, survey, capabilities, responsiveness, buggy"
request feature,"sophisticated, handle, technical, basic, complete, request, wide, feedback, efficiency, feature, organization, changes, ideas, everything"
specific problems,"specific, experience, able, several, team, nice, previous, migrate, account, market, price, report, rate, problems, works, company, lot"
friendly user,"flexible, friendly, excel, excellent, easy, innovative, interface, flexibility, product, platform, user, software, tools, panels, respondents, academics, setup, options"
comprehensive set,"comprehensive, best, love, different, set, weeks, things, feel, number"
quick response,"afford, complex, fantastic, quick, cost, email, ability, reports, solution, users, types, needs, staff, sales, response"
complex reports,"afford, complex, fantastic, quick, cost, email, ability, reports, solution, users, types, needs, staff, sales, response"
robust capabilities,"intuitive, responsive, robust, timeframe, qualtrics, surveys, functionality, usability, versatility, customer, ease, customization, tool, survey, capabilities, tutorials"
useful quality,"great, useful, simple, effective, improve, good, quality, researchers, data, questions, question, issues, system, help, guys"
friendly interface,"flexible, friendly, excel, excellent, easy, innovative, interface, flexibility, product, platform, user, software, tools, panels, respondents, academics, setup, options"
excellent platform,"flexible, friendly, excel, excellent, easy, innovative, interface, flexibility, product, platform, user, software, tools, panels, respondents, academics, setup, options"
continuous improvement,"improved, continuous, implement, powerful, integration, comprehensive, use, panel, improvement, logic, deployment, quality, feedback, email, afford, ability"
cost effective,"surveymonkey, multiple, effective, quick, professional, available, needs, question, cost, staff, issues, sales, web, response, design, create, system, training"
user friendly,"friendly, excel, excellent, easy, knowledgeable, innovative, helpful, flexibility, product, platform, user, software, features, panels, respondents, academics, setup, options"
complex functions,"great, useful, easier, complex, awesome, overall, simple, variables, functions, reports, client, researchers, solution, users, questions, types, respond"
quick response,"surveymonkey, multiple, effective, quick, professional, available, needs, question, cost, staff, issues, sales, web, response, design, create, system, training"
question design,"needs, question, cost, staff, issues, sales, web, response, design, create, system, training"
training staff,"needs, question, cost, staff, issues, sales, web, response, design, create, system, training"
tech support,"limitations, service, improvements, support, pricing, monkey, recommend, gooddata, willingness, tech"
usability functionality,"qualtrics, surveys, functionality, usability, versatility, customer, ease, tool, survey, capabilities, tutorials, interface"
complex reports,"great, useful, easier, complex, awesome, overall, simple, variables, functions, reports, client, researchers, solution, users, questions, types, respond"
